{
  "$schema": "https://json-schema.org/draft/2020-12/schema",
  "title": "Fixed-flow grid request v1",
  "description": "Parser additionally validates active axes, metric registry, increasing bounds, indexing and finite numbers.",
  "type": "object",
  "additionalProperties": false,
  "required": [
    "schema_version",
    "base",
    "x",
    "y",
    "metrics"
  ],
  "properties": {
    "schema_version": {
      "const": "grid-request-v1"
    },
    "base": {
      "type": "object",
      "additionalProperties": false,
      "properties": {
        "schema_version": {
          "const": "scenario-v1"
        },
        "model_version": {
          "const": "barnea-parallel-bound-o2-v1"
        },
        "flow": {
          "oneOf": [
            {
              "type": "object",
              "additionalProperties": false,
              "properties": {
                "mode": {
                  "const": "total_ratio"
                },
                "qt_ml_kg_min": {
                  "type": "number",
                  "exclusiveMinimum": 0
                },
                "r": {
                  "type": "number",
                  "exclusiveMinimum": 0
                }
              },
              "required": [
                "mode",
                "qt_ml_kg_min",
                "r"
              ]
            },
            {
              "type": "object",
              "additionalProperties": false,
              "properties": {
                "mode": {
                  "const": "independent_flows"
                },
                "qp_ml_kg_min": {
                  "type": "number",
                  "exclusiveMinimum": 0
                },
                "qs_ml_kg_min": {
                  "type": "number",
                  "exclusiveMinimum": 0
                }
              },
              "required": [
                "mode",
                "qp_ml_kg_min",
                "qs_ml_kg_min"
              ]
            }
          ]
        },
        "capacity": {
          "oneOf": [
            {
              "type": "object",
              "additionalProperties": false,
              "properties": {
                "mode": {
                  "const": "hb_linear"
                },
                "hb_g_dl": {
                  "type": "number",
                  "exclusiveMinimum": 0
                },
                "kappa_ml_o2_g_hb": {
                  "type": "number",
                  "exclusiveMinimum": 0
                }
              },
              "required": [
                "mode",
                "hb_g_dl",
                "kappa_ml_o2_g_hb"
              ]
            },
            {
              "type": "object",
              "additionalProperties": false,
              "properties": {
                "mode": {
                  "const": "direct_capacity"
                },
                "capacity_ml_dl": {
                  "type": "number",
                  "exclusiveMinimum": 0
                }
              },
              "required": [
                "mode",
                "capacity_ml_dl"
              ]
            }
          ]
        },
        "spv_fraction": {
          "type": "number",
          "minimum": 0,
          "maximum": 1
        },
        "vo2_target_ml_kg_min": {
          "type": "number",
          "minimum": 0
        }
      },
      "required": [
        "schema_version",
        "model_version",
        "flow",
        "capacity",
        "spv_fraction",
        "vo2_target_ml_kg_min"
      ],
      "$schema": "https://json-schema.org/draft/2020-12/schema",
      "title": "Legacy fixed-flow scenario V1"
    },
    "x": {
      "type": "object",
      "additionalProperties": false,
      "required": [
        "parameter",
        "min",
        "max",
        "n",
        "scale"
      ],
      "properties": {
        "parameter": {
          "type": "string"
        },
        "min": {
          "type": "number"
        },
        "max": {
          "type": "number"
        },
        "n": {
          "type": "integer",
          "minimum": 3,
          "maximum": 401
        },
        "scale": {
          "enum": [
            "linear",
            "log"
          ]
        }
      }
    },
    "y": {
      "type": "object",
      "additionalProperties": false,
      "required": [
        "parameter",
        "min",
        "max",
        "n",
        "scale"
      ],
      "properties": {
        "parameter": {
          "type": "string"
        },
        "min": {
          "type": "number"
        },
        "max": {
          "type": "number"
        },
        "n": {
          "type": "integer",
          "minimum": 3,
          "maximum": 401
        },
        "scale": {
          "enum": [
            "linear",
            "log"
          ]
        }
      }
    },
    "metrics": {
      "type": "array",
      "minItems": 1,
      "uniqueItems": true,
      "items": {
        "type": "string"
      }
    }
  }
}
